{
  "feed_version": "0.2.0",
  "published_at": "2026-10-06T17:55:00Z",
  "expires_at": "2026-10-06T18:05:00Z",
  "cache_ttl_seconds": 300,
  "freshness_class": "operational_state",
  "issuer": {
    "id": "https://consumer-demo.example",
    "name": "Fictional Demo Publisher",
    "type": "platform"
  },
  "subject": {
    "type": "platform",
    "id": "https://consumer-demo.example"
  },
  "scope": {
    "level": "platform",
    "identifier": "https://consumer-demo.example"
  },
  "overall_status": "operational",
  "components": [],
  "incidents": [],
  "maintenance_windows": []
}
