{
  "feed_version": "0.2.0",
  "published_at": "2026-05-16T20:40:00Z",
  "expires_at": "2026-05-16T20:45:00Z",
  "cache_ttl_seconds": 300,
  "freshness_class": "operational_state",
  "issuer": {
    "id": "https://platform.example",
    "name": "Example Platform",
    "type": "platform"
  },
  "subject": {
    "type": "platform",
    "id": "https://platform.example"
  },
  "scope": {
    "level": "platform",
    "identifier": "https://platform.example"
  },
  "overall_status": "operational",
  "components": [
    {
      "id": "agent-api",
      "name": "Agent API",
      "status": "operational",
      "surface": "external_agent",
      "capability_ids": ["crm.contact.read"],
      "region": "us-west",
      "last_changed_at": "2026-05-16T20:00:00Z"
    }
  ],
  "incidents": [],
  "maintenance_windows": []
}
